Symbol,Name,Url,Date_Published,Description,Sentiment,Positive_Score,Negative_Score,Neutral_Score
MSFT,Microsoft suspends new LinkedIn sign-ups in China,https://www.cnn.com/2021/03/11/tech/linkedin-china-microsoft-intl-hnk/index.html,2021-03-11T09:46:00.0000000Z,"\"Microsoft (MSFT) revealed last week that a group called Hafnium exploited its Exchange email service and was able to gain access to computers. The company said the group was \"\"assessed to be state-sponsored and operating out of China.\"\" A LinkedIn ...\"",negative,0.44,0.47,0.09
MSFT,Warren Buffett is now worth $100 billion,https://www.cnn.com/2021/03/11/business/warren-buffett-net-worth-intl-hnk/index.html,2021-03-11T10:30:00.0000000Z,"New York/Hong Kong ()Warren Buffett has just joined the world's most exclusive club of the mega rich. The legendary American investor was worth $100 billion on Thursday, according to the Bloomberg Billionaire's Index.",neutral,0.19,0.03,0.78
MSFT,Augmented Reality Finding Niche In Workplace,https://finance.yahoo.com/news/augmented-reality-finding-niche-workplace-150109789.html,2021-03-11T18:21:00.0000000Z,"With the era of augmented reality (AR) among us, the AR industry has a high potential and many offerings still unexplored by many. Apple (NASDAQ: APPL), Google (NASDAQ: GOOGL), Microsoft Corporation (NASDAQ: MSFT) and Magic Leap are exploring R&D initiatives with AR,",neutral,0.11,0.03,0.86
MSFT,ThredUp IPO: 5 things to know about the secondhand e-commerce site before it goes public,https://www.morningstar.com/news/marketwatch/20210311424/thredup-ipo-5-things-to-know-about-the-secondhand-e-commerce-site-before-it-goes-public,2021-03-11T07:57:00.0000000Z,"Oakland, Calif.-based online resale company ThredUp Inc. has filed its initial public offering prospectus with the Securities and Exchange Commission after first fi",neutral,0.0,0.04,0.96
MSFT,Microsoft Corp. stock outperforms market on strong trading day,https://www.msn.com/en-us/money/topstocks/microsoft-corp-stock-outperforms-market-on-strong-trading-day/ar-BB1euPdZ,2021-03-11T21:31:00.0000000Z,"Shares of Microsoft Corp. MSFT advanced 2.03% to $237.13 Thursday, on what proved to be an all-around great trading session for the stock market, with the S&P 500 Index SPX rising 1.04% to 3,939.34 and the Dow Jones Industrial Average DJIA rising 0.58% to ...",neutral,0.28,0.22,0.5
MSFT,Taking Advantage of Volatile Bounces,https://markets.businessinsider.com/news/stocks/taking-advantage-of-volatile-bounces-1030169381,2021-03-11T02:18:00.0000000Z,"InvestorPlace - Stock Market News, Stock Advice & Trading Tips Following the Nasdaq’s official drop into correction territory on Monday",neutral,0.0,0.0,1.0
MSFT,"\"The 6.9% Dividend With \"\"Baked In\"\" Double-Digit Upside\"",https://www.nasdaq.com/articles/the-6.9-dividend-with-baked-in-double-digit-upside-2021-03-11,2021-03-11T14:30:00.0000000Z,"That fund is the BlackRock Enhanced Global Dividend Trust (BOE), a closed-end fund (CEF) that trades at a 10% discount to net asset value (NAV, or the value of the stocks in its portfolio) and yields 6.",positive,0.53,0.0,0.47
MSFT,As U.K. eases COVID-19 lockdown restrictions — Pandemic Year 2 provides equal helpings of anxiety and hope,https://www.morningstar.com/news/marketwatch/20210311631/as-uk-eases-covid-19-lockdown-restrictions-pandemic-year-2-provides-equal-helpings-of-anxiety-and-hope,2021-03-11T11:09:00.0000000Z,"\"While everyone in London has felt the pain of the pandemic in one way or another, \"\"it is devastating for the poorer sections of our community","\"\" he told me as he managed to chisel in some time to speak with me over Skype (MSFT). \"\"The poorer sections of our ...\"",negative,0.0,1.0
MSFT,"Apple Inc. stock rises Thursday, still underperforms market",https://www.msn.com/en-us/money/topstocks/apple-inc-stock-rises-thursday-still-underperforms-market/ar-BB1euPe5,2021-03-11T21:31:00.0000000Z,"The stock demonstrated a mixed performance when compared to some of its competitors Thursday, as Microsoft Corp. MSFT rose 2.03% to $237.13, Alphabet Inc. Cl A GOOGL rose 3.16% to $2,100.54, and International Business Machines Corp. IBM fell 0.57% to $127.14.",neutral,0.01,0.01,0.98
MSFT,"The Microsoft Exchange hack shows attackers are working 'smarter, not harder,' experts say",https://www.businessinsider.in/tech/news/the-microsoft-exchange-hack-shows-attackers-are-working-smarter-not-harder-experts-say/articleshow/81458489.cms,2021-03-11T22:48:00.0000000Z,"\"Security experts said the Microsoft Exchange attack means hackers are working \"\"smarter","not harder.\"\" The recent hack has received less attention since victims were small- to mid-size organizations. But the hack could be a \"\"test run\"\" for a larger attack",",negative,0.01,0.99,0.0","",""
MSFT,"Clyburn, Klobuchar push $94 billion fix to digital divide",https://www.msn.com/en-us/news/politics/clyburn-klobuchar-push-2494-billion-fix-to-digital-divide/ar-BB1etFhx,2021-03-11T10:00:08.0000000Z,House Majority Whip James Clyburn (D-S.C.) and Sen. Amy Klobuchar (D-Minn.) are reintroducing legislation Thursday aimed at improving internet access in impoverished communities.,neutral,0.06,0.02,0.92
MSFT,Warren Buffett becomes the sixth richest person in the world as his net worth jumps $8.9 billion in one month to $100 BILLION,https://www.dailymail.co.uk/news/article-9351309/Warren-Buffett-joins-mega-rich-billionaires-club-worth-jumps-100-BILLION-ranks-sixth.html,2021-03-11T19:09:00.0000000Z,"The owner of the multinational conglomerate Berkshire Hathaway now joins an elite club of men worth $100billion or more, that includes Jeff Bezos and Elon Musk.",neutral,0.11,0.07,0.82
MSFT,Xbox Game Pass will have 20 Bethesda games starting tomorrow,https://www.digitaltrends.com/gaming/20-bethesda-games-coming-to-xbox-game-pass/,2021-03-11T19:07:00.0000000Z,"Following Microsoft’s completion of its recent acquisition of ZeniMax Media, Xbox Game Pass will add new Bethesda published games on Friday, March 12. The new additions will bring the service’s total Bethesda games up to 20. The news comes from a ...",neutral,0.01,0.01,0.98
MSFT,Millions in COVID relief funding to be used for federal cybersecurity efforts,https://www.wbaltv.com/article/millions-in-covid-relief-funding-to-be-used-for-federal-cybersecurity-efforts/35802556,2021-03-11T07:49:00.0000000Z,Millions of dollars in funding from the COVID-19 relief bill passed Wednesday will be used to help the federal government improve its cybersecurity efforts in the wake of high-profile breaches that have caused alarm for officials and lawmakers.,neutral,0.01,0.0,0.99
MSFT,"Fallout 4, Oblivion, Prey, and 8 more Bethesda games coming to Xbox Game Pass tomorrow",https://www.gamesradar.com/fallout-4-oblivion-prey-and-8-more-bethesda-games-coming-to-xbox-game-pass-tomorrow/,2021-03-11T18:39:00.0000000Z,"Fallout 4, The Elder Scrolls 4: Oblivion, and 2017's Prey are coming to Xbox Game Pass tomorrow, March 12, alongside eight other Bethesda games. The impending game lineup was announced today at a roundtable event discussing the immediate and long-term ...",neutral,0.01,0.28,0.71
MSFT,Data Center Power Market Size to Reach Revenues of around USD 22 Billion by 2026 - Arizton,https://www.tmcnet.com/usubmit/-data-center-power-market-size-reach-revenues-around-/2021/03/11/9323921.htm,2021-03-11T17:10:00.0000000Z,"The data center power market is expected to grow at a CAGR of approximately 5% during the period 2020-2026. Key Highlights Offered in the Report: In 2020, COVID-19 boost utilizati",neutral,0.24,0.01,0.75
MSFT,Xbox Game Pass gains 20 Bethesda games tomorrow,https://www.neowin.net/news/xbox-game-pass-gains-20-bethesda-games-tomorrow/,2021-03-11T13:42:00.0000000Z,"Microsoft has announced a massive wave of Xbox Game Pass games that will hit tomorrow March 12. The games are from eight Bethesda Softworks franchises, including The Elder Scrolls, Fallout, and more.",neutral,0.01,0.21,0.78
MSFT,"20 Bethesda games coming to Game Pass on Xbox, PC, and Cloud tomorrow",https://www.eurogamer.net/articles/2021-03-11-20-bethesda-games-coming-to-game-pass-on-xbox-pc-and-cloud-tomorrow,2021-03-11T18:57:00.0000000Z,"\"As part of a lengthy and largely revelation-free \"\"roundtable\"\" event this evening",Microsoft and Bethesda have announced that 20 Zenimax Media titles will be making their way to Game Pass on Xbox,PC,",neutral,0.08,0.06,0.86",""
MSFT,Women in CyberSecurity (WiCyS) hosting virtual career fair and global event,https://www.wfmz.com/news/pr_newswire/pr_newswire_stocks/women-in-cybersecurity-wicys-hosting-virtual-career-fair-and-global-event/article_ed253c85-6654-5330-8de5-57ae3bb48a32.html,2021-03-11T19:05:00.0000000Z,"COOKEVILLE, Tenn., March 11, 2021 /PRNewswire-PRWeb/ -- Women in CyberSecurity (WiCyS) is hosting back-to-back virtual events this month – the Spring Virtual Career Fair and the inaugural WiCyS Around the World. WiCyS is dedicated to recruiting ...",neutral,0.04,0.01,0.95
MSFT,What are the New Features in PlayStation 5,https://www.cioreview.com/news/what-are-the-new-features-in-playstation-5--nid-33099-cid-257.html,2021-03-11T05:53:00.0000000Z,What are the New Features in PlayStation 5 By CIOReview - PS5 is the next-generation PlayStation as it will facilitate high refresh rates with enhanced graphics in the games.,neutral,0.09,0.0,0.91
MSFT,"Wall Street headed higher on calmer bond markets, upbeat jobless claims data",https://sg.news.yahoo.com/futures-jump-calmer-bonds-inflation-120559681.html,2021-03-11T14:41:00.0000000Z,"Wall Street's main indexes were set to open higher on Thursday as U.S. bond yields retreated to one-week lows on ebbing concerns over a strong pick up in inflation, while data showed jobless claims fell more than expected last week.",negative,0.01,0.89,0.1
MSFT,US STOCKS-Wall Street jumps after upbeat jobless claims data,https://au.finance.yahoo.com/news/us-stocks-wall-street-jumps-153845285.html,2021-03-11T10:38:00.0000000Z,"March 11 (Reuters) - The blue-chip Dow index hit an all-time high for the fourth straight session on Thursday as worries about rising inflation eased, while a bigger-than-expected fall in weekly jobless claims reinforced expectations of a labor market ...",neutral,0.04,0.25,0.71
MSFT,"Inside Clean Energy: 10 Years After Fukushima, Safety Is Not the Biggest Problem for the US Nuclear Industry",https://insideclimatenews.org/news/11032021/inside-clean-energy-fukushima-anniversary-nuclear-united-states/,2021-03-11T14:00:00.0000000Z,"Today is an uncomfortable anniversary for the nuclear industry and for people who believe that nuclear power should be a crucial part of the transition to clean energy. On March 11, 2011, an earthquake and tsunami led to waves so high that they engulfed the Fukushima Daiichi nuclear power plant in Japan,",negative,0.08,0.73,0.19
MSFT,Xbox Game Pass just got these 20 Bethesda games — here’s whats coming,https://www.tomsguide.com/news/xbox-game-pass-bethesda,2021-03-11T19:59:00.0000000Z,"Xbox Game Pass will gain 20 classic Bethesda titles, from the original Doom, to the cult favorite Fallout: New Vegas, to the inventive shooter Prey. Information comes from the Xbox Wire blog, following up on an announcement earlier this week,",negative,0.11,0.8,0.09
MSFT,Warren Buffett's net worth reaches US$100 billion,https://www.channelnewsasia.com/news/business/warren-buffett-s-net-worth-reaches-us-100-billion-14379242,2021-03-11T04:51:00.0000000Z,"Warren Buffett's fortune reached US$100 billion on Wednesday, as investors drove the stock price for his company Berkshire Hathaway Inc to a",neutral,0.03,0.02,0.95
MSFT,How to Back Up All Your Photos Without a Cloud Subscription,https://gizmodo.com/how-to-back-up-all-your-photos-without-a-cloud-subscrip-1846434752,2021-03-11T18:30:00.0000000Z,You don’t necessarily have to pay by the month to keep your photos and videos safe. Photo: Liz Weddon/Unsplash The photos and videos you’ve captured are probably the most important files on ...,positive,0.94,0.01,0.05
MSFT,Lincoln Tech CEO To Address Education Technology Conference,https://sg.finance.yahoo.com/news/lincoln-tech-ceo-address-education-154200208.html,2021-03-11T10:42:00.0000000Z,"Lincoln Educational Services Corporation (NASDAQ: LINC), marking 75 years in 2021 as a national leader in specialized technical training, announces that President and CEO Scott Shaw will be a featured speaker at Landmark Ventures’ Social Innovation Summit on Wednesday,",neutral,0.0,0.0,1.0
MSFT,"US STOCKS-Wall St headed higher on calmer bond markets, upbeat jobless claims data",https://au.finance.yahoo.com/news/us-stocks-wall-st-headed-140247755.html,2021-03-11T14:02:00.0000000Z,"Wall Street's main indexes were set to open higher on Thursday as U.S. bond yields retreated to one-week lows on ebbing concerns over a strong pick up in inflation, while data showed jobless claims fell more than expected last week.",negative,0.01,0.89,0.1
MSFT,United States Data Center Infrastructure Management Market Forecast to 2027 - DCIM Market Forecast to Reach US$ 1496.0 Million by 2027,https://ca.finance.yahoo.com/news/united-states-data-center-infrastructure-091800165.html,2021-03-11T09:18:00.0000000Z,"\"The \"\"US Data Center Infrastructure Management Market Forecast to 2027 - COVID-19 Impact and Country Analysis by Component",Data Center Type,Application,"and Industry Vertical\"\" report has been added to ResearchAndMarkets.\"",neutral
MSFT,Aruba Accelerates Digital Transformation From Edge-to-Cloud on Microsoft Azure,https://in.news.yahoo.com/aruba-accelerates-digital-transformation-edge-090829399.html,2021-03-11T09:35:00.0000000Z,"New Solutions Simplify IoT Device Connectivity and Bring Aruba ESP to Microsoft Azure Bengaluru, Karnataka, India – Business Wire India Aruba, a Hewlett Packard Enterprise company, in collaboration with Microsoft, announced two new solutions that enable ...",neutral,0.0,0.0,1.0
MSFT,O2 Business launches digital workplace solution to support flexible working,https://www.telecomtv.com/content/access-evolution/o2-business-launches-digital-workplace-solution-to-support-flexible-working-41027/,2021-03-11T10:53:00.0000000Z,O2 is strengthening its Digital Workplace portfolio with two new Workplace Propositions – Device as a Service and O2 Voice for Microsoft Teams,neutral,0.0,0.0,1.0
MSFT,Billionaire Steve Cohen’s Top 5 Stock Picks,https://www.insidermonkey.com/blog/billionaire-steve-cohens-top-5-stock-picks-923748/,2021-03-11T17:51:00.0000000Z,"In this article, we discuss billionaire Steve Cohen’s top 5 stock picks. For Cohen’s investment philosophy and his comments on certain stocks, please see Billionaire Steve Cohen’s Top 10 Stock Picks.",neutral,0.07,0.05,0.88
MSFT,Microsoft Stops Supporting Old Edge Legacy Browser,https://www.techworm.net/2021/03/microsoft-stops-support-edge-legacy-browser.html,2021-03-11T16:58:00.0000000Z,"Last month, Microsoft had announced that it would be ending support for the Edge Legacy desktop application on March 9, 2021. After this date, Microsoft Edge Legacy would no longer be receiving security updates. With the support over, you will now no ...",mixed,0.44,0.38,0.18
MSFT,"Cloud Backup & Recovery Software Market Is Going to Boom : Microsoft, HP, IBM",http://www.sbwire.com/press-releases/cloud-backup-recovery-software-market-is-going-to-boom-microsoft-hp-ibm-1331083.htm,2021-03-11T22:08:00.0000000Z,Stay up to date with Cloud Backup & Recovery Software Market research offered by HTF MI. Check how key trends and emerging drivers are shaping this industry growth.,positive,0.6,0.02,0.38
MSFT,"Internet of Things (IoT) Software Market May Set New Growth Story: Major Giants Salesforce, Cisco, Thales",http://www.sbwire.com/press-releases/internet-of-things-iot-software-market-may-set-new-growth-story-major-giants-salesforce-cisco-thales-1330979.htm,2021-03-11T21:05:00.0000000Z,"\"Edison, NJ -- (SBWIRE) -- 03/11/2021 -- A new business intelligence report released by HTF MI with title \"\"COVID-19 Outbreak-Global Internet of Things (IoT) Software Industry Market Report-Development Trends",Threats,"Opportunities and Competitive Landscape ...\"",neutral,0.03
MSFT,Heimdal™ Releases Vulnerability Data on the Microsoft Exchange Patch,https://heimdalsecurity.com/blog/heimdal-releases-vulnerability-microsoft-exchange-patch/,2021-03-11T14:25:00.0000000Z,"According to Heimdal™ ‘s internal data, 85% of organizations have already applied the readily available patches that address the Microsoft Exchange vulnerabilities, through the use of automated vulnerability management and deployment.",negative,0.06,0.67,0.27
MSFT,Consegna guides Counties Power to the contact centre cloud with AWS,https://www.reseller.co.nz/article/686862/consegna-guides-counties-power-contact-centre-cloud-aws/,2021-03-11T04:29:00.0000000Z,Counties Power has joined a stream of companies migrating their contact centres to the cloud using Amazon Connect,neutral,0.0,0.01,0.99
CRM,"Healthcare CRM Market Size Competitive Landscape Global Industry Growth, Global Survey, Analysis, Share, and Forecast by 2027",https://www.marketwatch.com/press-release/healthcare-crm-market-size-competitive-landscape-global-industry-growth-global-survey-analysis-share-and-forecast-by-2027-2021-03-11,2021-03-11T23:14:00.0000000Z,Mar (Market Insight Reports) -- healthcare CRM (Customer Relationship Management) market is projected to reach value of USD 26.35 Billion by,neutral,0.01,0.03,0.96
CRM,"Salesforce Expects Lower Earnings, Making Its Stock No Bargain",https://investorplace.com/2021/03/salesforce-expects-lower-earnings-making-its-stock-no-bargain/,2021-03-11T22:19:00.0000000Z,"At today’s price (March 5) of $210.76 per share, CRM stock has a relatively high 62 times forward P/E multiple. This ratio is found by dividing $210.76 by the company’s forward estimate of $3 ...",neutral,0.0,0.02,0.98
CRM,"Nike, Boeing share gains lead Dow's nearly 200-point climb",https://www.marketwatch.com/story/nike-boeing-share-gains-lead-dows-nearly-200-point-climb-2021-03-11,2021-03-11T20:54:00.0000000Z,The Dow Jones Industrial Average is climbing Thursday afternoon with shares of Nike and Boeing leading the way for the blue-chip average. The Dow is,neutral,0.02,0.02,0.96
CRM,Cloopen Acquires CRM Software Provider EliteCRM For Undisclosed Sum,https://finance.yahoo.com/news/cloopen-acquires-crm-software-provider-184044151.html,2021-03-11T01:35:00.0000000Z,Chinese multi-capability cloud-based communications solution provider Cloopen Group Holding Ltd (NYSE: RAAS) inked an agreement to acquire customer relationship management (CRM) software provider EliteCRM.,neutral,0.0,0.0,1.0
CRM,"Marketing Creativity Needs an AI Assist, Forrester Says",https://www.destinationcrm.com/Articles/ReadArticle.aspx?ArticleID=145743,2021-03-11T17:32:00.0000000Z,Forrester analyst Jay Pattisall urges companies to adopt intelligent creativity that blends human and artificial intelligence to solve marketing challenges.,neutral,0.12,0.04,0.84
CRM,Goldman Sachs: These 3 Stocks Could Spike at Least 40%,https://finance.yahoo.com/news/goldman-sachs-3-stocks-could-161046151.html,2021-03-11T16:10:00.0000000Z,"Let’s talk volatility. The NASDAQ kicked off this week with a dip into correction territory, a fall to just over 10% below its February peak. And now? After three trading sessions, the index has bounced back by 5.",negative,0.01,0.57,0.42
CRM,Box: A Cheap Way To Play The Cloud,https://www.nasdaq.com/articles/box%3A-a-cheap-way-to-play-the-cloud-2021-03-11,2021-03-11T16:39:00.0000000Z,"Even though cloud computing has been around for over 20 years – the innovator in the space was Saleforce.com (CRM) – the market continues to grow at a rapid pace. The fact is that this technology offers much more flexibility, integration and access to ...",neutral,0.18,0.03,0.79
CRM,Boston Private Loses Two Advisors to Lido,https://www.wealthmanagement.com/people/boston-private-loses-two-advisors-lido,2021-03-11T22:32:00.0000000Z,Jeffrey Kaufman and John Tassone leave two months after SVB Financial agreed to buy Boston Private for $900 million.,neutral,0.04,0.23,0.73
CRM,The 5 Best Real Estate Marketing Companies of 2021,https://www.benzinga.com/pressreleases/21/03/ab20127582/the-5-best-real-estate-marketing-companies-of-2021,2021-03-11T18:28:00.0000000Z,"Let’s be honest here – as real estate agents we aren’t always the best marketers. Luckily, there are quality and trustworthy real estate marketing",negative,0.09,0.9,0.01
CRM,Home Health Care Services Industry | BizVibe Adds New Home Health Care Companies Which Can Be Discovered and Tracked,https://www.wfmz.com/news/pr_newswire/pr_newswire_health/home-health-care-services-industry-bizvibe-adds-new-home-health-care-companies-which-can-be/article_52f944b1-d06e-579d-96f9-bf8bb218d874.html,2021-03-11T20:00:00.0000000Z,"For sales teams, Bizvibe allows users to efficiently build prospects lists, track and evaluate companies, and integrate their CRM. This all-in-one platform was designed to equip users with all necessary tools needed to complete the entire buying/sales ...",neutral,0.07,0.0,0.93
CRM,Century Business Solutions Partners with LBMC Technology Solutions to Deliver Credit Card Processing within Microsoft Dynamics and Sage Intacct,https://www.benzinga.com/pressreleases/21/03/p20124139/century-business-solutions-partners-with-lbmc-technology-solutions-to-deliver-credit-card-processi,2021-03-11T16:00:00.0000000Z,The partnership between Century Business Solutions and LBMC Technology Solutions will allow merchants to process payments directly within Microsoft Dynamics and Sage,neutral,0.01,0.0,0.99
CRM,Hi Marley raises $25M to fund its AI-powered communication platform for the insurance industry,https://www.yahoo.com/entertainment/hi-marley-raises-25m-fund-160936853.html,2021-03-11T16:09:00.0000000Z,"If you’ve ever had to file a claim with your insurance company, you know that it's not exactly fun. Hi Marley is a Boston startup that has set out to modernize communications in the insurance space by giving carriers a way to “seamlessly” communicate with their policyholders via text.",negative,0.0,0.99,0.01
CRM,Fasturtle Partners with Marketing 360 to Bring Power of the...,https://patch.com/arizona/phoenix/ep/1822680,2021-03-11T20:51:00.0000000Z,"Fasturtle Partners with Marketing 360 to Bring Power of the Marketing 360 Technology to Fasturtle Clients (PHOENIX – March 10, 2021) – Marketing 360® and Phoenix’s own Fasturtle® today ...",neutral,0.0,0.0,1.0
CRM,Insurance Carriers Industry | BizVibe Adds New Insurance Carrier Companies Which Can Be Discovered and Tracked,https://markets.businessinsider.com/news/stocks/insurance-carriers-industry-bizvibe-adds-new-insurance-carrier-companies-which-can-be-discovered-and-tracked-1030175260,2021-03-11T21:01:00.0000000Z,"For sales teams, Bizvibe allows users to efficiently build prospects lists, track and evaluate companies, and integrate their CRM. This all-in-one platform was designed to equip users with all ...",neutral,0.06,0.0,0.94
CRM,Medical and Diagnostic Laboratories Industry | BizVibe Adds New Companies Which Can Be Discovered and Tracked,https://www.wfmz.com/news/pr_newswire/pr_newswire_health/medical-and-diagnostic-laboratories-industry-bizvibe-adds-new-companies-which-can-be-discovered-and-tracked/article_77cc12db-8f0e-5f8b-9d35-aea7208d74c5.html,2021-03-11T20:00:00.0000000Z,BizVibe has expanded the number of companies which can now be discovered and tracked for their medical and diagnostic laboratories industry group.,neutral,0.02,0.01,0.97
CRM,MuleSoft Empowers Business Teams to Deliver Digital Innovation Faster with MuleSoft Composer,https://apnews.com/press-release/pr-newswire/technology-business-corporate-news-products-and-services-new-products-and-services-99dc893ad52d779eba66f8b208011f4a/gallery/a2d2cefd050aade98f2f6d727576e244,2021-03-11T06:17:00.0000000Z,"MuleSoft, provider of the world’s #1 integration and API platform, today introduced MuleSoft Composer, the easiest way for business teams to integrate apps and data and deliver digital innovation faster.",neutral,0.1,0.0,0.9
CRM,"Icertis raises $80M, pushes past $2.8B valuation",https://www.bizjournals.com/seattle/news/2021/03/11/icertis-raises-80m-series-f.html,2021-03-11T11:00:00.0000000Z,"Bellevue-based Icertis announced Thursday it has raised an $80 million Series F and reached a valuation of more than $2.8 billion. B Capital Group led the round, while Greycroft, Meritech Capital Partners,",neutral,0.01,0.01,0.98
CRM,Rotary Corporation Chooses Workbooks Cloud CRM to Drive Success,https://ca.finance.yahoo.com/news/rotary-corporation-chooses-workbooks-cloud-140000885.html,2021-03-11T02:00:00.0000000Z,"Workbooks, the cloud-based CRM and marketing automation vendor, announces that Rotary Corporation, the world’s largest supplier of outdoor power equipment parts and tools, has chosen its platform to enhance its operations,",neutral,0.0,0.0,1.0
CRM,PatientBond Launches its Insights Accelerator™ Solution to Amplify Healthcare Provider Marketing Results with Consumer Science and Files,https://www.tmcnet.com/usubmit/2021/03/11/9323799.htm,2021-03-11T16:46:00.0000000Z,"PatientBond, the leading science driven patient engagement SaaS provider, announces the launch of Insights Accelerator™, a SaaS delivered application that provides access to unique and extensive market research and psychographic data on healthcare consumers.",neutral,0.0,0.0,1.0
CRM,Profit Derives From Usage – Not Initial Purchase,https://www.business2community.com/sales-management/profit-derives-from-usage-not-initial-purchase-02391699,2021-03-11T20:14:00.0000000Z,"Business customers have become increasingly used to as-a-service models, rather than outright purchase – and many of them have",negative,0.01,0.85,0.14
