Symbol,Name,Url,Date_Published,Description,Sentiment,Positive_Score,Negative_Score,Neutral_Score
FMC,Forum Energy Metals Closes Non-Brokered Private Placement,https://www.juniorminingnetwork.com/junior-miner-news/press-releases/769-tsx-venture/fmc/95003-forum-closes-non-brokered-private-placement.html,2021-03-11T13:34:00.0000000Z,"\"March 11, 2021) - Forum Energy Metals Corp. ( TSXV: FMC) ( OTCQB: FDCFF) (\"\"Forum\"\" or \"\"Company\"\") announces that",further to its news release of February 24,2021,it has closed its non-brokered private placement and raised $499,",neutral,0.02,0.01,0.97"
FMC,Global Oil & Gas Well Drilling Machinery Market latest Industry Developments and Future Growth Opportunities,https://ksusentinel.com/2021/03/11/global-oil-gas-well-drilling-machinery-market-latest-industry-developments-and-future-growth-opportunities/,2021-03-11T09:28:00.0000000Z,Industrial Growth of Oil & Gas Well Drilling Machinery Market 2021-2026: The latest report added by Reports Monitor demonstrates that the global Oil & Gas Well Drilling Machinery Market will showcase a steady CAGR in the coming years.,neutral,0.21,0.01,0.78
FMC,"House Investigates Alleged Importation, Manufacturing of Substandard Steel",https://www.thisdaylive.com/index.php/2021/03/11/house-investigates-alleged-importation-manufacturing-of-substandard-steel/,2021-03-11T00:25:00.0000000Z,while eight others were rescued and rushed to the Federal Medical Centre (FMC) in Owerri. He noted that the rescue operators later pulled out five more dead bodies from the debris of the building while the eight people taken to the hospital were later ...,negative,0.02,0.8,0.18
FMC,"Taraba government receives 56,250 doses of AstraZeneca COVID-19 vaccine",https://www.sunnewsonline.com/taraba-government-receives-56250-doses-of-astrazeneca-covid-19-vaccine/,2021-03-11T12:24:00.0000000Z,"Sylvanus Viashima, Jalingo The Taraba state government on Thursday took custody of fifty-six thousand, two hundred and fifty (56,250) doses",neutral,0.01,0.04,0.95
FMC,Non-resident banks may trade ringgit- denominated IRS effective March 15: BNM,http://www.dailyexpress.com.my/news/167723/non-resident-banks-may-trade-ringgit-denominated-irs-effective-march-15-bnm/,2021-03-11T08:32:00.0000000Z,"Bank Negara Malaysia (BNM) has announced that effective March 15, 2021, non-resident banks may trade ringgit-denominated interest rate swap (IRS) without any underlying commitment with any onshore ban",negative,0.01,0.51,0.48
FMC,Bello pardons blogger over report on N7b Kogi isolation centre,https://guardian.ng/news/bello-pardons-blogger-over-report-on-n7b-kogi-isolation-centre/,2021-03-11T04:04:00.0000000Z,"Kogi State Governor, Yahaya Bello, has pardoned the Bayelsa blogger and owner of Naija Live TV, Saint Mienpamo Onitsha, over report of a N7b COVID-19 Isolation Centre in Kogi State that was blown away by rainstorm.",negative,0.03,0.56,0.41
FMC,"Post-Harvest Treatment Market Share 2021: Global Trends, Key Players, Industry Analysis Report to 2027",https://www.openpr.com/news/2254980/post-harvest-treatment-market-share-2021-global-trends-key,2021-03-11T11:06:00.0000000Z,The post harvest treatment market is valued at 1 31 billion in 2018 and is expected to reach 2 1 billion by 2026 and is expected to grow at a CAGR of 5 from 2021 to 2027 The vegetable and,neutral,0.08,0.0,0.92
FMC,TechnipFMC’s (FTI) Equal Weight Rating Reiterated at Morgan Stanley,https://www.modernreaders.com/news/2021/03/11/technipfmcs-fti-equal-weight-rating-reiterated-at-morgan-stanley.html,2021-03-11T23:13:00.0000000Z,"TechnipFMC (NYSE:FTI)‘s stock had its “equal weight” rating restated by equities researchers at Morgan Stanley in a report issued on Monday, Benzinga reports. They currently have a $8.80 price target on the oil and gas company’s stock.",neutral,0.0,0.02,0.98
FMC,TechnipFMC plc (NYSE:FTI): The Metrics That Matter Right Now,https://stocksregister.com/2021/03/11/technipfmc-plc-nysefti-the-metrics-that-matter-right-now/,2021-03-11T17:00:00.0000000Z,"TechnipFMC plc (NYSE:FTI) price on Thursday, Mar 11, rose 0.61% above its previous day’s close as an upside momentum from buyers pushed the stock’s value to $9.15. Get the hottest stocks to trade every day before the market opens 100% free.",positive,0.75,0.0,0.25
FMC,TechnipFMC plc [FTI] is 16.94% higher this YTD. Is it still time to buy?,https://dbtnews.com/2021/03/11/technipfmc-plc-fti-is-16-94-higher-this-ytd-is-it-still-time-to-buy/,2021-03-11T00:35:00.0000000Z,"TechnipFMC Plc (SAO:T1EC34) will be discussing their earnings results in their 2020 Fourth Quarter Earnings call to be held on February 25, 2021 at 8:00 AM Eastern Time. Even if you’re not actively in crypto,",neutral,0.0,0.06,0.94
RNG,Greenlane Renewables Announces Fourth Quarter and Fiscal Year 2020 Financial Results,https://apnews.com/press-release/business-wire/business-technology-alternative-and-sustainable-energy-dairy-product-manufacturing-products-and-services-d841fc24ba8d460d98aab65badeaa66e,2021-03-11T21:36:00.0000000Z,"Greenlane Renewables Inc. (“ Greenlane ” or the “ Company ”) (TSX: GRN / FSE: 52G / OTC: GRNWF), today announced financial results for the fourth quarter and fiscal year ended December 31, 2020. For further information on these results please see the Company’s Audited Consolidated Financial Statements and Management’s Discussion and Analysis filed on SEDAR at  All amounts are in Canadian dollars unless otherwise stated and in accordance with IFRS.",neutral,0.01,0.18,0.81
RNG,Small and Mid-Sized Businesses Lead the Transition to Working from Anywhere,https://finance.yahoo.com/news/small-mid-sized-businesses-lead-120000132.html,2021-03-11T12:00:00.0000000Z,"It suggests that the majority of small and medium businesses have already embraced people working from anywhere and plan to support a mix of in-office and remote working for the long term future. According to these findings,",positive,0.87,0.02,0.11
RNG,"What's in your natural gas, VT? 'Digester' turns ice cream, beer and manure into fuel",https://www.burlingtonfreepress.com/story/news/2021/03/11/vermont-gas-digester-turns-manure-and-food-waste-into-methane-fuel/6906184002/,2021-03-11T10:10:00.0000000Z,A large new farm and food waste methane plant in Salisbury is gearing up to pump renewable fuel into Vermont Gas pipelines by mid-spring.,negative,0.0,0.88,0.12
RNG,‘Genshin Impact’ Selling Power Has Created An Endgame Content Void,https://www.forbes.com/sites/paultassi/2021/03/11/genshin-impact-selling-power-has-created-an-endgame-content-void/,2021-03-11T15:50:00.0000000Z,"Genshin Impact selling power really hurts the entire purpose of the endgame, and there needs to be some kind of middleground.",negative,0.0,1.0,0.0
RNG,2nd Quantum phone is almost here and it’s based on the Galaxy A82,https://www.sammobile.com/news/2nd-quantum-phone-almost-here-based-on-galaxy-a82/,2021-03-11T15:06:00.0000000Z,Samsung and South Korean network operator SK Telecom have reportedly joined forces once again for the purpose of creating a,neutral,0.01,0.12,0.87
RNG,Aemetis Reports 2020 Fourth Quarter and Year-End Results,https://finance.yahoo.com/news/aemetis-reports-2020-fourth-quarter-130000967.html,2021-03-11T13:00:00.0000000Z,"CUPERTINO, CA / ACCESSWIRE /  /Aemetis, Inc. (NASDAQ:AMTX), a renewable natural gas and renewable fuels company focused on below zero carbon intensity products, today announced its financial results for the three and twelve months ended December 31,",neutral,0.0,0.0,1.0
RNG,Letter: National Grid's commitment to a sustainable future laudable,https://www.msn.com/en-us/weather/topstories/letter-national-grids-commitment-to-a-sustainable-future-laudable/ar-BB1etXsE,2021-03-11T12:18:58.0000000Z,Coalition for Renewable National Gas Member National Grid is right to acknowledge renewable natural gas (RNG) as an important asset in the fight against climate change and as an indispensable resource in Massachusetts’ march toward decarbonization.,neutral,0.04,0.35,0.61
RNG,"Aemetis, Inc.: Aemetis Reports 2020 Fourth Quarter and Year-End Results",https://www.finanznachrichten.de/nachrichten-2021-03/52265081-aemetis-inc-aemetis-reports-2020-fourth-quarter-and-year-end-results-200.htm,2021-03-11T13:09:00.0000000Z,"CUPERTINO, CA / ACCESSWIRE / March 11, 2021 / Aemetis, Inc. (NASDAQ:AMTX), a renewable natural gas and renewable fuels company focused on below zero carbon intensity products, today announced its fina",neutral,0.0,0.0,1.0
RNG,"Clean Energy Fuels, BP Create JV for RNG Fuel Production",https://www.ttnews.com/articles/clean-energy-fuels-bp-create-jv-rng-fuel-production,2021-03-11T15:45:00.0000000Z,"Clean Energy Fuels Corp. announced it finalized a joint venture with BP Products North America Inc., a subsidiary of BP, to develop, own and operate new renewable natural gas projects at dairies and other agriculture facilities.",neutral,0.07,0.0,0.93
RNG,AMP Americas Brings Largest Dairy RNG Project Online,https://www.waste360.com/waste-energy/amp-americas-brings-largest-dairy-rng-project-online,2021-03-11T06:34:00.0000000Z,"CHICAGO – Amp Americas, a pioneer in the renewable transportation fuel industry, today announced that its fourth biogas facility producing renewable natural gas (RNG) from dairy waste is now operational and has begun delivering RNG into the Alliance natural gas pipeline to be used as transportation fuel.",negative,0.0,0.66,0.34
RNG,Clean Energy Starts Refueling Heavy-Duty Fleets at New RNG Station,https://ngtnews.com/clean-energy-starts-refueling-heavy-duty-fleets-at-new-rng-station,2021-03-11T14:44:00.0000000Z,"Clean Energy Fuels Corp., a provider of clean fuel to the transportation market, has opened a new public fueling station in Carson, Calif., that will",positive,0.7,0.0,0.3
RNG,Bill introduced to establish clean fuels standard in Minnesota,http://ethanolproducer.com/articles/18060/bill-introduced-to-establish-clean-fuels-standard-in-minnesota,2021-03-11T22:39:00.0000000Z,"Ethanol, biodiesel, renewable diesel, renewable natural gas (RNG), sustainable aviation fuel (SAF), propane, renewable propane, hydrogen, and electricity are among the fuels that could be used to comply with the CFS. The American Coalition for Ethanol has ...",neutral,0.01,0.01,0.98
RNG,CBA receives funding to help farmers discover on-farm biogas potential,https://www.bioenergy-news.com/news/cba-receives-funding-to-help-farmers-discover-on-farm-biogas-potential/,2021-03-11T11:02:00.0000000Z,"Funding of up to $116,800 (€77,500) has been allocated to the Canadian Biogas Association (CBA) to boost sustainable agricultural development,",neutral,0.19,0.01,0.8
RNG,"Sabre Corporation (NASDAQ:SABR) Spiked 4.6%, What’s Next? Hint, Don’t Be Too Excited",https://stocksregister.com/2021/03/11/sabre-corporation-nasdaqsabr-spiked-4-6-whats-next-hint-dont-be-too-excited/,2021-03-11T19:00:00.0000000Z,"Sabre Corporation (NASDAQ:SABR) price on Thursday, Mar 11, rose 4.6% above its previous day’s close as an upside momentum from buyers pushed the stock’s value to $16.16. Get the hottest stocks to trade every day before the market opens 100% free.",positive,0.75,0.0,0.25
RNG,Market Analysts see Clean Energy Fuels Corp. [CLNE] gaining to $17. Time to buy?,https://dbtnews.com/2021/03/11/market-analysts-see-clean-energy-fuels-corp-clne-gaining-to-17-time-to-buy/,2021-03-11T16:32:00.0000000Z,"CLNE] jumped around 1.79 points on Wednesday, while shares priced at $13.59 at the close of the session, up 15.17%. The company report on March 10, 2021 that Clean Energy to Make More Carbon-Negative Fuel Available for Transportation with bp.",negative,0.11,0.87,0.02
RNG,10 Things You Need To Know Before Playing We Need To Go Deeper,https://www.thegamer.com/we-need-to-go-deeper-essential-tips-tricks-before-playing/,2021-03-11T19:30:00.0000000Z,"From the importance of assigning roles to the difference between submarines, here are some things about We Need To Go Deeper new players need to know.",positive,0.58,0.1,0.32
RNG,Playtech Online Casino Content Goes Live with Kindred Brands,https://www.casinonewsdaily.com/2021/03/11/playtech-online-casino-content-goes-live-with-kindred-brands/,2021-03-11T12:59:00.0000000Z,"Playtech has launched its Casino content with Kindred’s flagship online gambling brand Unibet and is set to roll out its titles with the operator’s other brands, as well.",neutral,0.0,0.01,0.99
RNG,Playtech to supply casino products to Kindred Group,https://www.cdcgamingreports.com/playtech-to-supply-casino-products-to-kindred-group/,2021-03-11T04:00:00.0000000Z,"Industry giant Playtech has signed a new partnership with Kindred Group, to launch its RNG casino offering across the operator’s 9 brands, including its flagship Unibet brand. Following the initial launch on Unibet’s UK and .",neutral,0.01,0.01,0.98
RNG,Playtech revenue down in 2020 as retail closures hit B2B and B2C segments,https://igamingbusiness.com/playtech-revenue-down-in-2020-as-retail-closures-hit-b2b-and-b2c-segments/,2021-03-11T10:49:00.0000000Z,Playtech saw revenue decrease 25.1% to €1.08bn (£924.8m/$1.29bn) as retail closures due to Covid-19 had an impact on both the supplier’s business-to-business (B2B) and business-to-consumer (B2C) operations.,neutral,0.0,0.01,0.99
RNG,"Chevron Looking to Permian, Duvernay and Vaca Muerta for Onshore Growth",https://www.naturalgasintel.com/chevron-looking-to-permian-duvernay-and-vaca-muerta-for-onshore-growth/,2021-03-11T19:57:00.0000000Z,Chevron Corp. CEO Michael Wirth during the annual investor meeting on Tuesday said the supermajor’s message to investors could best be summed up in four,positive,0.84,0.0,0.16
RNG,Athens Services lands contract with California city,https://www.wastetodaymagazine.com/article/athens-services-thousand-oaks-california-waste-recycling-contract/,2021-03-11T09:07:00.0000000Z,"Athens Services, which is headquartered in the City of Industry, California, was awarded the exclusive 15-year franchise waste and recycling collection contract by the city of Thousand Oaks, California,",negative,0.0,0.98,0.02
RNG,"City of Thousand Oaks, California, Awards 15-year Waste Contract to Athens Services",https://www.waste360.com/collection-transfer/city-thousand-oaks-california-awards-15-year-waste-contract-athens-services,2021-03-11T06:06:00.0000000Z,"In a late-night motion, the Council moved to award Athens the contract based on a recommendation from City staff and R3 Consulting Group.",neutral,0.19,0.02,0.79
RNG,"City of Thousand Oaks, CA, Awards 15-year Waste Contract to Athens Services",https://wasteadvantagemag.com/city-of-thousand-oaks-ca-awards-15-year-waste-contract-to-athens-services/,2021-03-11T05:00:00.0000000Z,"In a unanimous 5-0 City Council vote on March 9, Southern California-based Athens Services was awarded the exclusive 15-year franchise waste and recycling",negative,0.0,0.99,0.01
RNG,Playtech Casino now live with Kindred Group,https://www.gamesbras.com/english-version/2021/3/11/playtech-casino-now-live-with-kindred-group-22035.html,2021-03-11T13:35:00.0000000Z,"Playtech announces a new partnership with Kindred Group to launch its award-winning Casino (RNG) offering across Kindred Group’s 9 brands, including flagship brand, Unibet. Following the initial launch on Unibet’s UK and .",neutral,0.01,0.01,0.98
RNG,Hearthstone Battlegrounds tier list: the best heroes to play in 2021,https://www.theloadout.com/hearthstone-battlegrounds/tier-list-best-heroes,2021-03-11T16:35:00.0000000Z,"We explain which of Hearthstone Battleground's 50+ heroes are worth your time Are you one of the hordes of people that can’t get enough of Hearthstone Battlegrounds? The card-brawling autobattler can eat up a fair bit of your spare time,",negative,0.01,0.93,0.06
ZM,"Why Facebook, Zoom Video, and Okta Stocks All Jumped on Thursday",https://www.msn.com/en-us/finance/topstocks/why-facebook-zoom-video-and-okta-stocks-all-jumped-on-thursday/ar-BB1euPZL,2021-03-11T22:00:00.0000000Z,"Shares of Facebook , Zoom Video Communications , and Okta (NASDAQ:OKTA) all jumped sharply on Friday. By the time the market closed, these stocks were up 3.4%, 5.3%",neutral,0.01,0.11,0.88
ZM,"Zoom Video Communications Inc (ZM) COO Aparna Bawa Sold $843,451 of Shares",https://finance.yahoo.com/news/zoom-video-communications-inc-zm-021503315.html,2021-03-11T02:15:00.0000000Z,"Zoom Video Communications Inc has a market cap of $98.08 billion; its shares were traded at around $336.030000 with a P/E ratio of 149.36 and P/S ratio of 37.86. CFO Kelly Steckelberg sold 20,000 shares of ZM stock on 03/05/2021 at the average price of $334.",neutral,0.0,0.01,0.99
ZM,Emotional valence sensing using a wearable facial EMG device,https://www.nature.com/articles/s41598-021-85163-z,2021-03-11T13:51:00.0000000Z,"Emotion sensing using physiological signals in real-life situations can be practically valuable. Previous studies have developed wearable devices that record autonomic nervous system activity, which reflects emotional arousal.",mixed,0.44,0.39,0.17
ZM,7 Stocks That Cathie Wood Likes and You Should Too,https://markets.businessinsider.com/news/stocks/7-stocks-that-cathie-wood-likes-and-you-should-too-1030174707,2021-03-11T17:38:00.0000000Z,"InvestorPlace - Stock Market News, Stock Advice & Trading Tips You might know her as the matriarch of Wall Street, a woman who proved that",neutral,0.02,0.01,0.97
ZM,"Brazil's Lula, Bolsonaro fire starting gun on 2022 presidential race",https://www.reuters.com/article/us-brazil-politics-lula-idUSKBN2B21ZM,2021-03-11T03:10:00.0000000Z,"SAO BERNARDO DO CAMPO, Brazil (Reuters) - Former Brazilian President Luiz Inacio Lula da Silva and President Jair Bolsonaro on Wednesday both fired an early starting gun on a 2022 election set to be dominated by the raging pandemic, a weak economy and deep ...",negative,0.0,1.0,0.0
ZM,Discount in Walmart Stock Is Too Compelling to Ignore,https://markets.businessinsider.com/news/stocks/discount-in-walmart-wmt-stock-too-compelling-to-ignore-1030175738,2021-03-11T21:21:00.0000000Z,"InvestorPlace - Stock Market News, Stock Advice & Trading Tips A rare event has transpired for Walmart (NYSE:WMT), and it should have",neutral,0.01,0.01,0.98
ZM,3 Lessons for Investors From 1 Year of the Pandemic,https://www.nasdaq.com/articles/3-lessons-for-investors-from-1-year-of-the-pandemic-2021-03-11,2021-03-11T16:45:00.0000000Z,"Fear drags everything down. Even something that stood to benefit from the changes such as Zoom (ZM) was hit, dropping around 20% at this time last year. Apple, the richest, most successful company ever, lost 35%, the kind of drop that you see when a ...",mixed,0.62,0.36,0.02
ZM,"One year after WHO declared COVID-19 a pandemic, what have YOU learned?",https://www.morningstar.com/news/marketwatch/20210311796/one-year-after-who-declared-covid-19-a-pandemic-what-have-you-learned,2021-03-11T14:57:00.0000000Z,"\"It's exactly one year since the World Health Organization declared the coronavirus public-health emergency a \"\"pandemic.\"\" Looking back",we can see how far we have come,and how we have already begun the return to a kind of normality,",neutral,0.07,0.27,0.66",""
ZM,Oracle's 3rd-Quarter Results: Looking Beyond the Numbers,https://finance.yahoo.com/news/oracles-3rd-quarter-results-looking-203750106.html,2021-03-11T20:37:00.0000000Z,"Oracle's rapidly growing highly profitable, multi-billion dollar cloud ERP businesses helped drive subscription revenue up 5% and operating income up 10% in the quarter. Subscription revenue now accounts for 72% of Oracle's total revenues,",neutral,0.08,0.01,0.91
ZM,"'The regular fury of ambulance sirens slowly went away': One year into the COVID-19 pandemic, what have YOU learned?",https://www.morningstar.com/news/marketwatch/20210311820/the-regular-fury-of-ambulance-sirens-slowly-went-away-one-year-into-the-covid-19-pandemic-what-have-you-learned,2021-03-11T15:25:00.0000000Z,"\"It's exactly one year since the World Health Organization declared the coronavirus public-health emergency a \"\"pandemic.\"\" Looking back",we can see how far we have come,and how we have already begun the return to a kind of normality,",neutral,0.07,0.27,0.66",""
ZM,GE’s 8-for-1 Reverse Stock Split Shows CEO Culp’s Dow Jones Ambitions,https://investorplace.com/2021/03/ge-stock-8-for-1-reverse-stock-split/,2021-03-11T20:24:00.0000000Z,"Zoom Video (NASDAQ:ZM), one of tech’s most expensive companies, peaked at a 125x price-to-sales ratio in November before falling 40%. Though few investors expect growth stocks to come crashing ...",negative,0.07,0.91,0.02
ZM,"West Jefferson property transfers for Feb. 18-22, 2021. See a list of home and other sales",https://www.nola.com/entertainment_life/home_garden/article_d1eaf822-801a-11eb-bded-5f0e8914d978.html,2021-03-11T11:45:00.0000000Z,Below is a compilation of properties sold in West Jefferson Parish from Feb. 18-22. Data is compiled from public records.,neutral,0.01,0.01,0.98
ZM,Growing Adoption of Content-Driven Marketing Strategies Fueling Positive Growth for Tech Stocks,https://www.marketwatch.com/press-release/growing-adoption-of-content-driven-marketing-strategies-fueling-positive-growth-for-tech-stocks-2021-03-11-81974635,2021-03-11T14:33:00.0000000Z,"\"A report from Data Bridge Market Research said: \"\"The growing adoption of content-driven marketing strategy will propel the growth of the market through 2028. The increase in the demand for such software by all sorts of industries will further boom up the market value.\"",neutral,0.21,0.06,0.73
ZM,US considers using NASA facility to house migrant children,https://www.msn.com/en-us/news/us/us-considers-using-nasa-facility-to-house-migrant-children/ar-BB1etewx?tblci=GiC8Az9qA-7sI49Z8ES9lXTFwYw4_JXtEgQg204zm9v77CCC-00,2021-03-11T05:14:00.0000000Z,"A NASA site in California is being considered as a potential location to house the growing number of migrants coming across the border, according to sources briefed on the plans.   Sources told ABC News that plans are still in flux,",neutral,0.01,0.08,0.91
ZM,"Man, woman arrested in Hampton carjacking, robbery were out on bond on other charges",https://www.dailypress.com/news/crime/dp-nw-robberies-chase-20210311-5bxfh5zm5fh75berwhylg4ntoe-story.html,2021-03-11T20:23:00.0000000Z,"An 18-year-old woman and a 25-year old man arrested last week in a series of recent carjackings and robberies in Hampton were out on bond on other charges at the time of the incidents, court records show. Alice Marie Robinson, 18, of Clayton Drive in ...",negative,0.0,0.97,0.03
ZM,What Will the Stock Market Do Today? 3 Big Stories to Watch.,https://www.msn.com/en-us/money/topstocks/what-will-the-stock-market-do-today-3-big-stories-to-watch/ar-BB1eunzl,2021-03-11T20:21:00.0000000Z,"Investors flocked to buy stocks that benefitted from the pandemic environment, such as Zoom Video (NASDAQ:ZM) and Moderna (NASDAQ:MRNA). ZM shares gained more than 450%, while MRNA shares added on nearly 600%. Investors also rushed to buy the dip on stocks ...",negative,0.01,0.74,0.25
ZM,Mexican lawmakers advance bill to legalize recreational pot,https://www.kiro7.com/news/world/mexican-lawmakers/GDGDVL627Q5Z7NPMFEB6ZM6T5I/,2021-03-11T03:31:00.0000000Z,Mexico’s lower chamber has approved a marijuana legalization bill setting the country on the path to becoming one of the world’s largest legal marijuana markets,neutral,0.0,0.01,0.99
ZM,"Thinking of Buying Zoom Video Communications, Inc. (NASDAQ:ZM) Stock? Here’s What You Need to Know",https://stocksregister.com/2021/03/11/thinking-of-buying-zoom-video-communications-inc-nasdaqzm-stock-heres-what-you-need-to-know/,2021-03-11T19:00:00.0000000Z,"Zoom Video Communications, Inc. (NASDAQ:ZM) price on Thursday, Mar 11, rose 3.65% above its previous day’s close as an upside momentum from buyers pushed the stock’s value to $348.29. Get the hottest stocks to trade every day before the market opens ...",neutral,0.05,0.02,0.93
ZM,"CrowdStrike Holdings, Inc. (NASDAQ:CRWD): Making Its Way To A Higher Share Price",https://stocksregister.com/2021/03/11/crowdstrike-holdings-inc-nasdaqcrwd-making-its-way-to-a-higher-share-price/,2021-03-11T20:00:00.0000000Z,"CrowdStrike Holdings, Inc. (NASDAQ:CRWD) price on Thursday, Mar 11, rose 5.01% above its previous day’s close as an upside momentum from buyers pushed the stock’s value to $204.62. A look at the stock’s price movement,",neutral,0.01,0.23,0.76
ZM,"Dynamic Technology Lab Private Ltd Purchases 2,625 Shares of Zoom Video Communications, Inc. (NASDAQ:ZM)",https://www.modernreaders.com/news/2021/03/11/dynamic-technology-lab-private-ltd-purchases-2625-shares-of-zoom-video-communications-inc-nasdaqzm.html,2021-03-11T07:52:00.0000000Z,"Dynamic Technology Lab Private Ltd boosted its position in shares of Zoom Video Communications, Inc. (NASDAQ:ZM) by 260.2% during the 4th quarter, HoldingsChannel.com reports. The fund owned 3,634 shares of the company’s stock after buying an additional 2,",neutral,0.0,0.01,0.99
ZM,Restoration of Melrose High building brings hope to Orange Mound community,https://www.fox13memphis.com/rss-snd/restoration-melrose-high-building-brings-hope-orange-mound-community/Y2ZM5BUVMRHMDONTZUBJNUGWJ4/,2021-03-11T06:33:00.0000000Z,"MEMPHIS, Tenn. — Memphis city leaders are working to bring new life to a historic building in Orange Mound. City leaders released details of the two-year process and $10 billion plan to restore the old Melrose High School building. Some in Orange Mound ...",neutral,0.01,0.02,0.97
