Symbol,Name,Url,Date_Published,Description,Sentiment,Positive_Score,Negative_Score,Neutral_Score
NFLX,‘Sons of Anarchy’ Creator Kurt Sutter Makes Film Directorial Debut with ‘This Beast’ for Blumhouse and Netflix,https://nerdcoremovement.com/sons-of-anarchy-creator-kurt-sutter-makes-film-directorial-debut-with-this-beast-for-blumhouse-and-netflix/,2021-03-11T08:31:00.0000000Z,"\"\"\"Sons of Anarchy\"\" creator Kurt Sutter will make his directorial debut for Blumhouse with an upcoming film called \"\"This Beast\"\"\"",negative,0.03,0.66,0.31
NFLX,"\"\"\"Operation Varsity Blues\"\" from Netflix--AcademicInfluence.com Examines the Truth Behind the College Admissions Scandal\"",https://www.lelezard.com/en/news-19694718.html,2021-03-11T15:07:00.0000000Z,"\"FORT WORTH, Texas, March 11, 2021 /PRNewswire/ -- \"\"Is there any risk that this thing blows up in my face?\"\" Or so one parent asks in Operation Varsity Blues: The College Admissions Scandal","the new Netflix documentary debuting March 17. In this ripped-from ...\"",negative,0.0,0.93
NFLX,There’s a new version of Selling Sunset coming to Netflix with an all-black female cast,https://thetab.com/uk/2021/03/11/new-selling-sunset-spin-off-netflix-all-black-female-cast-florida-198651,2021-03-11T11:49:00.0000000Z,"What’s the only thing better than Selling Sunset? More of it. And in the last 24-hours Netflix has not just confirmed two new seasons of the actual Selling Sunset, but also that a new version has been commissioned.",mixed,0.48,0.41,0.11
WMT,Discount in Walmart Stock Is Too Compelling to Ignore,https://www.msn.com/en-us/finance/topstocks/discount-in-walmart-stock-is-too-compelling-to-ignore/ar-BB1euzlR,2021-03-11T21:21:00.0000000Z,Walmart is struggling this year. But history says big dips in WMT stock are buying opportunities for patient investors.,negative,0.01,0.97,0.02
WMT,Higher ore prices push Nickel Asia’s 2020 income,https://mb.com.ph/2021/03/12/higher-ore-prices-push-nickel-asias-2020-income/,2021-03-11T23:00:00.0000000Z,"During the period, the company exported a total of 10.0 million wet metric tons (WMT) of nickel ore in 2020, down 4 percent from 10.4 million WMT in 2019. However, ore export prices increased 45 percent from $23.52 per WMT of ore sold in 2019 to $33.99 per ...",neutral,0.0,0.02,0.98
WMT,COVID Relief Bill Could Trigger Larger Tax Bills For Gig Workers,https://finance.yahoo.com/news/covid-relief-bill-could-trigger-184639997.html,2021-03-11T18:46:00.0000000Z,"Gig workers and third-party sellers on e-commerce platforms such as Etsy, Inc. (NASDAQ: ETSY), Walmart Marketplace (NYSE: WMT) and even Amazon (NASDAQ: AMZN) could find themselves with tax issues in 2022 thanks to a change in Internal Revenue Service tax codes contained within the American Rescue Plan Act of 2021.",positive,0.85,0.0,0.15
WMT,Nickel Asia’s 2020 profit exceeds P4B,https://www.manilatimes.net/2021/03/12/business/companies/nickel-asias-2020-profit-exceeds-p4b/850209/,2021-03-11T21:15:00.0000000Z,"Nickel Asia sold an aggregate 10 million wet metric tons (WMT) of nickel ore last year, lower than the year-earlier’s 10.4 million WMT. But ore export prices soared by 45 percent year-on-year to $33.99 per WMT from $23.52 per WMT. Last year, Nickel Asia ...",neutral,0.01,0.01,0.98
WMT,Walmart taps Gen Z with TikTok livestream beauty event,https://www.marketwatch.com/story/walmart-to-host-its-latest-tiktok-event-as-more-companies-use-the-platform-to-tap-young-shoppers-11615490294,2021-03-11T19:44:00.0000000Z,"Walmart Inc. WMT, +0.12% is hosting its latest livestream TikTok event on Thursday at 9 p.m. Eastern Time, building on the better-than-expected results of its first event, hosted in December 2020. “Spring Shop-Along: Beauty Edition” will take place on the Walmart TikTok page and will be hosted by Gabby Morrison,",neutral,0.23,0.01,0.76
WMT,Better Buy: Netflix vs. Amazon,https://www.fool.com/investing/2021/03/11/better-buy-netflix-vs-amazon/,2021-03-11T12:44:00.0000000Z,"While that still lags Walmart's (NYSE:WMT) $555 billion in net sales, Walmart earns most revenue from in-store retailing. Also, Amazon has started a successful cloud computing business, AWS. It maintains a significant market lead over competitors ...",negative,0.0,0.99,0.01
WMT,Can Target Keep Growing in 2021?,https://www.fool.com/investing/2021/03/11/can-target-keep-growing-in-2021/,2021-03-11T15:00:00.0000000Z,Target grew sales at a record pace in 2020 that widened the market share gap with peers like Walmart (NYSE:WMT). Most of the credit goes to the billions of dollars that the retailer directed in prior years toward turning its stores into delivery and ...,neutral,0.03,0.13,0.84
WMT,3 Stocks With Notable Insider Transactions In March,https://finance.yahoo.com/news/3-stocks-notable-insider-transactions-145624820.html,2021-03-11T14:56:00.0000000Z,"Agree Realty is a real estate investment trust (REIT) that acquires and develops retail net lease properties. Agree leases its properties to some of the country's top retailers in their respective sectors including Walmart (NYSE: WMT),",positive,0.9,0.02,0.08
WMT,"Amazon Intensifies Grocery War With 11th Fresh Store Launch, 28 In Pipeline: Bloomberg",https://www.benzinga.com/news/21/03/20122056/amazon-intensifies-grocery-war-with-11th-fresh-store-launch-28-in-pipeline-bloomberg,2021-03-11T15:41:00.0000000Z,"Amazon.Com Inc (NASDAQ: AMZN) is building a national grocery chain amidst the pandemic as other businesses struggled for survival, Bloomberg reports. What Happened: Amazon Fresh store, which marked its Los Angeles debut in September, inaugurated its ...",negative,0.0,0.85,0.15
WMT,Walmart to host its latest TikTok event as more companies use the platform to tap young shoppers,https://www.morningstar.com/news/marketwatch/20210311734/walmart-to-host-its-latest-tiktok-event-as-more-companies-use-the-platform-to-tap-young-shoppers,2021-03-11T13:18:00.0000000Z,"\"Walmart Inc. (WMT) is hosting its latest livestream TikTok event on Thursday at 9 p.m. Eastern Time, building on the better-than-expected results of its first event, hosted in December 2020. \"\"Spring Shop-Along: Beauty Edition\"\" will take place on the Walmart TikTok page and will be hosted by Gabby Morrison (link)",",positive,0.56,0.01,0.43","","",""
WMT,7 Stocks To Buy as Bernie and AOC Push for a $15 Minimum Wage,https://markets.businessinsider.com/news/stocks/7-stocks-to-buy-as-bernie-and-aoc-push-for-a-15-minimum-wage-1030172495,2021-03-11T14:50:00.0000000Z,"InvestorPlace - Stock Market News, Stock Advice & Trading Tips Despite Congress’ failure to make the move to a $15 minimum wage,",negative,0.0,0.93,0.07
WMT,"Zack Snyder, HBO Max To Host Live Watch Party Online For ‘Justice League’ Recut",https://www.forbes.com/sites/dbloom/2021/03/11/zack-snyder-hbo-max-to-host-live-watch-online-party-for-justice-league/,2021-03-11T17:20:00.0000000Z,Director Zack Snyder will lead a live chat and online screening of his #SnyderCut version of 2017 blockbuster 'Justice League' on co-watching app Scener.com on March 18. The recut version will debut next week on subscription video service HBO Max.,neutral,0.0,0.01,0.99
WMT,Barron's,https://www.barrons.com/articles/luxury-is-ripe-for-a-comeback-here-are-three-retailers-to-buy-51615476683,2021-03-11T19:31:00.0000000Z,"Tapestry, Farfetch, and MYT Netherlands Parent are stocks that Cowen analyst Oliver Chen has moved to top-pick status.",neutral,0.02,0.01,0.97
WMT,Goldman Sachs pledges $10 billion to change the lives of 'One Million Black Women',https://www.morningstar.com/news/marketwatch/20210311803/goldman-sachs-pledges-10-billion-to-change-the-lives-of-one-million-black-women,2021-03-11T15:02:00.0000000Z,"and Apple (AAPL), as well as consumer groups such as Walmart (WMT) and PepsiCo (PEP), have pledged tens of billions of dollars to help tackle systemic racism in the aftermath of the police killing of George Floyd last year, which led to weeks of protests ...",negative,0.01,0.97,0.02
WMT,Beyond Meat (BYND) Expands Product Distribution at Walmart,https://markets.businessinsider.com/news/stocks/beyond-meat-bynd-expands-product-distribution-at-walmart-9900703,2021-03-11T07:40:00.0000000Z,"Want the latest recommendations from Zacks Investment Research? Today, you can download 7 Best Stocks for the Next 30 Days. Click to get this",positive,0.98,0.0,0.02
WMT,"GameStop, Reopening Trade, DraftKings: 3 Things to Watch",https://sg.finance.yahoo.com/news/gamestop-reopening-trade-draftkings-3-153952394.html,2021-03-11T01:33:00.0000000Z,"Investors have been nervous that the reopening of the economy plus the federal relief money might spark higher inflation, and that caused a big rise in government bond yields in the last few weeks that slammed technology stocks.",negative,0.05,0.92,0.03
WMT,American Rescue Plan,https://www.benzinga.com/topic/american-rescue-plan,2021-03-11T18:46:00.0000000Z,Walmart Marketplace (NYSE: WMT) and even Amazon (NASDAQ: AMZN) could find themselves with tax issues in 2022 thanks to a change in Internal Revenue Service tax codes contained within the American,positive,0.59,0.12,0.29
WMT,Can Walmart Crack The Tiktok Code? Tune In Tonight And See,https://www.forbes.com/sites/sharonedelson/2021/03/11/can-walmart-crack-the-tiktok-code-tune-in-tonight-and-see/,2021-03-11T22:39:00.0000000Z,"The retailer tonight will take to TikTok for the second time as the popular platform continues to experiment with shoppable ads and shoppable livestreams, and attracts brands such as NYX and L’Oreal.",neutral,0.05,0.03,0.92
WMT,New Transformers: Vintage Beast Wars Coming to Walmart Collector Con,https://www.ign.com/articles/new-transformers-vintage-beast-wars-coming-to-walmart-collector-con-release-date,2021-03-11T09:00:00.0000000Z,"Each figure is exactly how you remember it, from the sculpt and accessories right down to the period-perfect packaging.",positive,0.97,0.0,0.03
WMT,Walmart to begin offering COVID vaccines throughout the Miami Valley Saturday,https://sports.yahoo.com/walmart-begin-offering-covid-vaccines-193700841.html?src=rss,2021-03-11T19:38:00.0000000Z,Mar. 11—Walmart will begin administering coronavirus vaccines at multiple locations throughout the Miami Valley on Saturday. Patients can sign up for appointments starting today at www.Walmart ...,neutral,0.1,0.08,0.82
WMT,Walmart exec hopes COVID-19 vaccine supply will outpace demand in coming weeks,https://www.ksat.com/news/local/2021/03/11/walmart-exec-hopes-covid-19-vaccine-supply-will-outpace-demand-in-coming-weeks/,2021-03-11T20:37:00.0000000Z,"As vaccine production continues to ramp up, Walmart Executive Vice President Dan Bartlett said the retail giant continues to administer thousands of vaccines to residents across the United States.",neutral,0.02,0.01,0.97
WMT,Thinking of Buying Walmart Inc. (NYSE:WMT) Stock? Here’s What You Need to Know,https://stocksregister.com/2021/03/11/thinking-of-buying-walmart-inc-nysewmt-stock-heres-what-you-need-to-know/,2021-03-11T21:01:00.0000000Z,"Walmart Inc. (NYSE:WMT) price on Thursday, Mar 11, dropped -0.03% below its previous day’s close as a downside momentum from buyers pushed the stock’s value to $132.13. Get the hottest stocks to trade every day before the market opens 100% free.",mixed,0.38,0.41,0.21
WMT,Willis Investment Counsel Acquires New Shares in Walmart Inc. (NYSE:WMT),https://www.modernreaders.com/news/2021/03/11/willis-investment-counsel-acquires-new-shares-in-walmart-inc-nysewmt.html,2021-03-11T20:50:00.0000000Z,"Willis Investment Counsel acquired a new stake in shares of Walmart Inc. (NYSE:WMT) during the 4th quarter, according to its most recent disclosure with the Securities and Exchange Commission (SEC). The firm acquired 43,230 shares of the retailer’s stock ...",neutral,0.01,0.01,0.98
WMT,Market Analysts see Walmart Inc. [WMT] gaining to $170. Time to buy?,https://dbtnews.com/2021/03/11/market-analysts-see-walmart-inc-wmt-gaining-to-170-time-to-buy/,2021-03-11T00:28:00.0000000Z,"WHY: Rosen Law Firm, a global investor rights law firm, reminds purchasers of the securities of Walmart Inc. (NYSE: WMT) between March 30, 2016 and December 22, 2020, inclusive (the “Class Period”), of the important March 22,",neutral,0.02,0.01,0.97
WMT,Tag: RYB stock,https://marketingsentinel.com/tag/ryb-stock/,2021-03-11T21:00:00.0000000Z,"BigCommerce Holdings Inc. (NASDAQ: BIGC) announced that it would join forces with Walmart Inc (NYSE: WMT), one of the largest American retailers. The ability... Marketing Sentinel is a free online newspaper packed with exclusive content,",positive,0.53,0.02,0.45
WMT,Walmart Inc. (NYSE:WMT) Shares Purchased by Argent Trust Co,https://www.modernreaders.com/news/2021/03/11/walmart-inc-nysewmt-shares-purchased-by-argent-trust-co.html,2021-03-11T18:40:00.0000000Z,"Argent Trust Co grew its stake in shares of Walmart Inc. (NYSE:WMT) by 1.9% in the 4th quarter, HoldingsChannel.com reports. The institutional investor owned 128,061 shares of the retailer’s stock after acquiring an additional 2,335 shares during the ...",neutral,0.11,0.02,0.87
WMT,Nickel Asia income climbs 52%,https://www.bworldonline.com/nickel-asia-income-climbs-52/,2021-03-11T16:02:00.0000000Z,"NICKEL ASIA Corp. posted an attributable net income of P4.07 billion for 2020 or a 51.9% increase year on year due to higher ore export prices. In a regulatory filing on Thursday, the listed company said its total revenues rose 21.",neutral,0.0,0.02,0.98
WMT,Tag: ACIC stock,https://marketingsentinel.com/tag/acic-stock/,2021-03-11T13:00:00.0000000Z,"BigCommerce Holdings Inc. (NASDAQ: BIGC) announced that it would join forces with Walmart Inc (NYSE: WMT), one of the largest American retailers. The ability... Marketing Sentinel is a free online newspaper packed with exclusive content,",positive,0.53,0.02,0.45
WMT,CZR Resources moves to join growing ranks of ASX iron ore producers,https://www.msn.com/en-au/finance/markets/czr-resources-moves-to-join-growing-ranks-of-asx-iron-ore-producers/ar-BB1esJsE,2021-03-11T01:55:52.0000000Z,Iron ore exploration company CZR Resources (ASX:CZR) is aiming to follow a raft of new producers into the booming sector with its Robe Mesa project in WA.,neutral,0.0,0.0,1.0
WMT,Former Broadcast Park meteorologist Mike Hamernik dies after battle with lung cancer,https://www.msn.com/en-us/news/us/former-broadcast-park-meteorologist-mike-hamernik-dies-after-battle-with-lung-cancer/ar-BB1euubE,2021-03-11T17:49:00.0000000Z,"The Chicago native was 60 years old. Hamernik spent the last 19 years of his career in his hometown - but started his time in broadcasting in Cedar Rapids, working as a meteorologist for KGAN and WMT. Former KGAN reporter Judy Wang - who now works at WGN ...",neutral,0.13,0.12,0.75
WMT,Fenix reaches Iron Ridge nameplate capacity,https://www.australianmining.com.au/news/fenix-reaches-iron-ridge-nameplate-capacity/,2021-03-11T00:51:00.0000000Z,"Fenix Resources has completed its ramp up of the Iron Ridge iron ore mine in Western Australia, with the company achieving nameplate road haulage levels.",neutral,0.01,0.0,0.99
WMT,"Walmart, Sam’s Club locations add COVID-19 vaccinations",https://nj1015.com/walmart-sams-club-locations-add-covid-19-vaccinations/,2021-03-11T21:18:00.0000000Z,"You can add 34 Sam's Club and Walmart locations to the list of retail locations offering a COVID-19 vaccine. They join CVS, Rite Aid, Shop Rite, Stop & Shop and Walgreens as chains where at least ...",neutral,0.03,0.04,0.93
WMT,"Walmart vaccinating those next up in eligibility, upon appointment openings",https://www.fourstateshomepage.com/news/walmart-vaccinating-those-next-up-in-eligibility-upon-appointment-openings/,2021-03-11T21:51:00.0000000Z,"MISSOURI – On February 12, Walmart began administering Covid-19 vaccines to those eligible in several states, including Missouri. Now, Walmart is providing unused, “leftover” vaccines to individuals outside of each state’s current priority phase as ...",neutral,0.01,0.02,0.97
WMT,Element Electronics Named Walmart's Supplier of the Year,http://sip-trunking.tmcnet.com/news/2021/03/11/9323989.htm,2021-03-11T20:52:00.0000000Z,"At Walmart's recent Supplier Growth Forum, Element Electronics was named Entertainment, Toys, and Seasonal Supplier of the Year. In addition, Element won Supplier of the Year in the Consumer Electronics category. The Supplier of the Year award is presented ...",mixed,0.64,0.26,0.1
WMT,Wallmart Stock – Walmart exec hopes COVID-19 vaccine supply will outpace demand in coming weeks,https://fintechzoom.com/fintech_news_walmart/wallmart-stock-walmart-exec-hopes-covid-19-vaccine-supply-will-outpace-demand-in-coming-weeks/,2021-03-11T22:07:00.0000000Z,"As vaccine production continues to ramp up, Walmart Executive Vice President Dan Bartlett said the retail giant continues to administer thousands of vaccines to residents across the United States. Currently,",neutral,0.1,0.04,0.86
WMT,Area Walmart pharmacies administering COVID vaccine,https://www.msn.com/en-us/money/companies/area-walmart-pharmacies-administering-covid-vaccine/ar-BB1euye1,2021-03-11T18:22:00.0000000Z,"JONESBORO, Ark. (KAIT) - Numerous Walmart stores across Northeast Arkansas and Southeast Missouri have begun administering COVID-19 vaccines. In Jonesboro, both Supercenters and both Neighborhood Markets, as well as Sam’s Club have available appointments ...",neutral,0.04,0.01,0.95
WMT,Walmart to begin offering COVID-19 vaccines at several Miami Valley locations,https://www.wdtn.com/video/walmart-to-begin-offering-covid-19-vaccines-at-several-miami-valley-locations/6428911/,2021-03-11T22:35:00.0000000Z,"Walmart announced that it will begin offering COVID-19 vaccines at several locations in the Miami Valley starting Saturday, March 13.",neutral,0.01,0.02,0.97
DIS,Disney (DIS) Vs Netflix (NFLX): Which Streaming Stock Is A Better Buy?,https://www.nasdaq.com/articles/disney-dis-vs-netflix-nflx%3A-which-streaming-stock-is-a-better-buy-2021-03-11,2021-03-11T15:33:00.0000000Z,Which Of These Streaming Stocks Is On Top Of Your Watchlist? Investors are bullish on streaming stocks as the sector continues to benefit from the impact of the coronavirus pandemic. Anyone looking for the best streaming stocks to buy at one point might have contemplated Walt Disney’s (NYSE: DIS) Disney+ or Netflix (NASDAQ: NFLX).,positive,0.81,0.09,0.1
DIS,Interesting DIS Put And Call Options For April 30th,https://www.nasdaq.com/articles/interesting-dis-put-and-call-options-for-april-30th-2021-03-11,2021-03-11T16:29:00.0000000Z,"Investors in Walt Disney Co. (Symbol: DIS) saw new options begin trading today, for the April 30th expiration. At Stock Options Channel, our YieldBoost formula has looked up and down the DIS options chain for the new April 30th contracts and identified one put and one call contract of particular interest.",positive,0.74,0.02,0.24
DIS,"\"Premiere: MPH And Coco Combine For Hotly-Anticipated Garage Stomper \"\"Levelz 2 Dis\"\"\"",https://www.yahoo.com/entertainment/premiere-mph-coco-combine-hotly-172845592.html,2021-03-11T17:28:00.0000000Z,I caught a vibe straight away and I knew we had something big… we had it finished in a couple of days!” “Levelz 2 Dis” is exclusive to iTunes from Monday before hitting all platforms on March 22. Get into it below.,neutral,0.12,0.09,0.79
DIS,Disney's (DIS) Media Deal With NHL to Aid Streaming Growth,https://finance.yahoo.com/news/disneys-dis-media-deal-nhl-130901258.html,2021-03-11T13:09:00.0000000Z,"\"The Walt Disney's DIS latest seven-year media rights deal with The National Hockey League (\"\"NHL\"\") is set to accelerate the former’s plan to evolve as a streaming power house. The media giant has ...\"",neutral,0.0,0.01,0.99
DIS,Legendary Producer Debra Martin Chase On Her Success And CBS Smash Hit ‘The Equalizer’,https://www.forbes.com/sites/simonthompson/2021/03/11/legendary-producer-debra-martin-chase-on-her-success-and-cbs-smash-hit-the-equalizer/,2021-03-11T22:30:00.0000000Z,"Inside the recently renewed show, which boasts Queen Latifah in the lead role, that broke records with its post-Super Bowl debut.",negative,0.01,0.95,0.04
DIS,3 Reasons to Buy Disney Stock Now,https://www.fool.com/investing/2021/03/11/3-reasons-to-buy-disney-stock-now/,2021-03-11T17:00:00.0000000Z,"Follow @dannyvena The past year has been both the best of times and the worst of times for Disney (NYSE:DIS). The company has struggled with the on and off closures of its theme parks and resorts, and its movie business has essentially stalled.",negative,0.06,0.94,0.0
DIS,Westbrook Studios Developing Animated Feature Adaptation Of Graphic Novel ‘Canto’,https://deadline.com/2021/03/will-smith-jada-pinkett-smith-westbrook-studios-developing-animated-feature-adaptation-of-graphic-novel-canto-1234712626/,2021-03-11T22:28:00.0000000Z,"Along the way, Canto befriends a fierce Malorex, finds a Hermit who lives in a mechanical squid, and works with a mysterious warrior named Aulaura who helps him infiltrate the City of Dis.",neutral,0.39,0.01,0.6
DIS,3 Top Robinhood Stocks to Buy in March,https://www.fool.com/investing/2021/03/11/3-top-robinhood-stocks-to-buy-in-march/,2021-03-11T15:13:00.0000000Z,"Despite the coronavirus pandemic shuttering operations at its parks and resorts segment, crushing its theatrical-film business, and creating programming challenges for its media-networks business, Walt Disney (NYSE:DIS) stock managed to rocket to a new high.",neutral,0.0,0.03,0.97
DIS,Bloc Québécois MPs join Liberals to cut off debate on assisted-dying bill,https://www.msn.com/en-ca/news/canada/bloc-qu%C3%A9b%C3%A9cois-mps-join-liberals-to-cut-off-debate-on-assisted-dying-bill/ar-BB1euSlL?bcid=5cf7e0e5100db404a0b43694&bhid=5e068fab1c43b514d43b5d84&dis=communication_four&dm=meals-no-shipping&c=15006097389542886612%25252C9256196298201099741%25252C3720890262484345677%25252C17221804531433837120%25252C6986634565810285214%25252C3708542881471327804&mkt=en-sg%25252Cen-sg%25252Cen-sg%25252Cen-sg%25252Cen-sg%25252Cen-sg&parent-subcat=foodnews,2021-03-11T22:25:00.0000000Z,"OTTAWA — With the support of the Bloc Québécois, the minority Liberal government moved to ensure a bill to expand access to medical assistance in dying is put to a final vote Thursday in the House of Commons. Bloc MPs joined Liberals to pass a closure ...",negative,0.11,0.7,0.19
DIS,Joe Biden’s background presidency,https://www.washingtonpost.com/politics/2021/03/11/joe-bidens-background-presidency/,2021-03-11T19:17:00.0000000Z,"When he was running for president last year, one of Joe Biden’s pitches to voters was that, if he won, they would be able to stop paying attention to the White House all the time. “Remember when you didn’t have to think about the president every single day,",positive,0.53,0.43,0.04
DIS,7 Media Stocks to Binge on in a Post-WandaVision World,https://investorplace.com/2021/03/7-media-stocks-to-binge-on-in-a-post-wandavision-world/,2021-03-11T17:19:00.0000000Z,"Streaming platforms have thrived during the pandemic but amid the competition, these seven media stocks show long-term potential.",neutral,0.08,0.39,0.53
DIS,Walt Disney Brings NHL Games To Its Platforms,https://finance.yahoo.com/news/walt-disney-brings-nhl-games-133253113.html,2021-03-11T13:33:00.0000000Z,"The partnership between Disney (DIS) and the NHL will begin from the 2021-2022 season. NHL Commissioner Gary Bettman said, “Not only will this groundbreaking, seven-year deal enable the NHL to ...",neutral,0.06,0.01,0.93
DIS,"1 Year After NHL’s Covid Shutdown, Gary Bettman And Bill Daly Remain Nimble In Their Planning",https://www.forbes.com/sites/carolschram/2021/03/11/1-year-after-nhls-covid-shutdown-gary-bettman-and-bill-daly-remain-nimble-in-their-planning/,2021-03-11T20:07:00.0000000Z,"One year after the coronavirus brought sports leagues including the NHL to a halt, Gary Bettman and Bill Daly reflected on the past 12 months and offered a snapshot of the challenges that still lie ahead.",negative,0.05,0.71,0.24
DIS,Allele frequency of variants reported to cause adenine phosphoribosyltransferase deficiency,https://www.nature.com/articles/s41431-020-00805-6,2021-03-11T22:57:00.0000000Z,"Adenine phosphoribosyltransferase deficiency is a rare, autosomal recessive disorder of purine metabolism that causes nephrolithiasis and progressive chronic kidney disease. The s",negative,0.01,0.88,0.11
DIS,Disney+ Surpasses 100 Million Global Subscribers Just 16 Months After Launching,https://www.marketwatch.com/press-release/disney-surpasses-100-million-global-subscribers-just-16-months-after-launching-2021-03-11,2021-03-11T16:50:00.0000000Z,"Disney+ has surpassed the 100 million global subscriber mark just 16 months after its launch. During the company’s annual shareholder meeting, which was held virtually Tuesday, chief executive officer Bob Chapek said Disney’s flagship streaming service is shattering all initial expectations.",negative,0.0,0.95,0.05
DIS,No sign Oxford-AstraZeneca vaccine causes blood clots: Canadian health authorities,https://www.msn.com/en-ca/news/canada/no-sign-oxford-astrazeneca-vaccine-causes-blood-clots-canadian-health-authorities/ar-BB1euw5k?bcid=5cf7e0e5100db404a0b43694&bhid=5e068fab1c43b514d43b5d84&dis=communication_four&dm=meals-no-shipping&c=15006097389542886612%2525252C9256196298201099741%2525252C3720890262484345677%2525252C17221804531433837120%2525252C6986634565810285214&mkt=en-sg%2525252Cen-sg%2525252Cen-sg%2525252Cen-sg%2525252Cen-sg&parent-subcat=foodnews,2021-03-11T18:39:00.0000000Z,"OTTAWA — Canadian health authorities are keeping a watchful eye on European investigations of the Oxford-AstraZeneca vaccine after reports of blood clots following inoculations, but say there is no evidence they were caused by the vaccine. At least nine ...",neutral,0.02,0.16,0.82
